Resource Type,Metric,Metric Display Name,Unit,Aggregation Type,Description,Enable for monitoring,Tag Name,Threshold,Operator,Eval Frequency,Window Size,Aggregation Time,Alert Name,Alert Description,Severity
Microsoft.NotificationHubs/Namespaces/NotificationHubs,incoming,Incoming Messages,Count,Total,"The count of all successful send API calls.",,,,,,,,,,
Microsoft.NotificationHubs/Namespaces/NotificationHubs,incoming.all.failedrequests,All Incoming Failed Requests,Count,Total,"Total incoming failed requests for a notification hub",,,,,,,,,,
Microsoft.NotificationHubs/Namespaces/NotificationHubs,incoming.all.requests,All Incoming Requests,Count,Total,"Total incoming requests for a notification hub",,,,,,,,,,
Microsoft.NotificationHubs/Namespaces/NotificationHubs,incoming.scheduled,Scheduled Push Notifications Sent,Count,Total,"Scheduled Push Notifications Sent",,,,,,,,,,
Microsoft.NotificationHubs/Namespaces/NotificationHubs,incoming.scheduled.cancel,Scheduled Push Notifications Cancelled,Count,Total,"Scheduled Push Notifications Cancelled",,,,,,,,,,
Microsoft.NotificationHubs/Namespaces/NotificationHubs,installation.all,Installation Management Operations,Count,Total,"Installation Management Operations",,,,,,,,,,
Microsoft.NotificationHubs/Namespaces/NotificationHubs,installation.delete,Delete Installation Operations,Count,Total,"Delete Installation Operations",,,,,,,,,,
Microsoft.NotificationHubs/Namespaces/NotificationHubs,installation.get,Get Installation Operations,Count,Total,"Get Installation Operations",,,,,,,,,,
Microsoft.NotificationHubs/Namespaces/NotificationHubs,installation.patch,Patch Installation Operations,Count,Total,"Patch Installation Operations",,,,,,,,,,
Microsoft.NotificationHubs/Namespaces/NotificationHubs,installation.upsert,Create or Update Installation Operations,Count,Total,"Create or Update Installation Operations",,,,,,,,,,
Microsoft.NotificationHubs/Namespaces/NotificationHubs,notificationhub.pushes,All Outgoing Notifications,Count,Total,"All outgoing notifications of the notification hub",,,,,,,,,,
Microsoft.NotificationHubs/Namespaces/NotificationHubs,outgoing.allpns.badorexpiredchannel,Bad or Expired Channel Errors,Count,Total,"The count of pushes that failed because the channel/token/registrationId in the registration was expired or invalid.",,,,,,,,,,
Microsoft.NotificationHubs/Namespaces/NotificationHubs,outgoing.allpns.channelerror,Channel Errors,Count,Total,"The count of pushes that failed because the channel was invalid not associated with the correct app throttled or expired.",,,,,,,,,,
Microsoft.NotificationHubs/Namespaces/NotificationHubs,outgoing.allpns.invalidpayload,Payload Errors,Count,Total,"The count of pushes that failed because the PNS returned a bad payload error.",,,,,,,,,,
Microsoft.NotificationHubs/Namespaces/NotificationHubs,outgoing.allpns.pnserror,External Notification System Errors,Count,Total,"The count of pushes that failed because there was a problem communicating with the PNS (excludes authentication problems).",,,,,,,,,,
Microsoft.NotificationHubs/Namespaces/NotificationHubs,outgoing.allpns.success,Successful notifications,Count,Total,"The count of all successful notifications.",,,,,,,,,,
Microsoft.NotificationHubs/Namespaces/NotificationHubs,outgoing.apns.badchannel,APNS Bad Channel Error,Count,Total,"The count of pushes that failed because the token is invalid (APNS status code: 8).",,,,,,,,,,
Microsoft.NotificationHubs/Namespaces/NotificationHubs,outgoing.apns.expiredchannel,APNS Expired Channel Error,Count,Total,"The count of token that were invalidated by the APNS feedback channel.",,,,,,,,,,
Microsoft.NotificationHubs/Namespaces/NotificationHubs,outgoing.apns.invalidcredentials,APNS Authorization Errors,Count,Total,"The count of pushes that failed because the PNS did not accept the provided credentials or the credentials are blocked.",,,,,,,,,,
Microsoft.NotificationHubs/Namespaces/NotificationHubs,outgoing.apns.invalidnotificationsize,APNS Invalid Notification Size Error,Count,Total,"The count of pushes that failed because the payload was too large (APNS status code: 7).",,,,,,,,,,
Microsoft.NotificationHubs/Namespaces/NotificationHubs,outgoing.apns.pnserror,APNS Errors,Count,Total,"The count of pushes that failed because of errors communicating with APNS.",,,,,,,,,,
Microsoft.NotificationHubs/Namespaces/NotificationHubs,outgoing.apns.success,APNS Successful Notifications,Count,Total,"The count of all successful notifications.",,,,,,,,,,
Microsoft.NotificationHubs/Namespaces/NotificationHubs,outgoing.gcm.authenticationerror,GCM Authentication Errors,Count,Total,"The count of pushes that failed because the PNS did not accept the provided credentials the credentials are blocked or the SenderId is not correctly configured in the app (GCM result: MismatchedSenderId).",,,,,,,,,,
Microsoft.NotificationHubs/Namespaces/NotificationHubs,outgoing.gcm.badchannel,GCM Bad Channel Error,Count,Total,"The count of pushes that failed because the registrationId in the registration was not recognized (GCM result: Invalid Registration).",,,,,,,,,,
Microsoft.NotificationHubs/Namespaces/NotificationHubs,outgoing.gcm.expiredchannel,GCM Expired Channel Error,Count,Total,"The count of pushes that failed because the registrationId in the registration was expired (GCM result: NotRegistered).",,,,,,,,,,
Microsoft.NotificationHubs/Namespaces/NotificationHubs,outgoing.gcm.invalidcredentials,GCM Authorization Errors (Invalid Credentials),Count,Total,"The count of pushes that failed because the PNS did not accept the provided credentials or the credentials are blocked.",,,,,,,,,,
Microsoft.NotificationHubs/Namespaces/NotificationHubs,outgoing.gcm.invalidnotificationformat,GCM Invalid Notification Format,Count,Total,"The count of pushes that failed because the payload was not formatted correctly (GCM result: InvalidDataKey or InvalidTtl).",,,,,,,,,,
Microsoft.NotificationHubs/Namespaces/NotificationHubs,outgoing.gcm.invalidnotificationsize,GCM Invalid Notification Size Error,Count,Total,"The count of pushes that failed because the payload was too large (GCM result: MessageTooBig).",,,,,,,,,,
Microsoft.NotificationHubs/Namespaces/NotificationHubs,outgoing.gcm.pnserror,GCM Errors,Count,Total,"The count of pushes that failed because of errors communicating with GCM.",,,,,,,,,,
Microsoft.NotificationHubs/Namespaces/NotificationHubs,outgoing.gcm.success,GCM Successful Notifications,Count,Total,"The count of all successful notifications.",,,,,,,,,,
Microsoft.NotificationHubs/Namespaces/NotificationHubs,outgoing.gcm.throttled,GCM Throttled Notifications,Count,Total,"The count of pushes that failed because GCM throttled this app (GCM status code: 501-599 or result:Unavailable).",,,,,,,,,,
Microsoft.NotificationHubs/Namespaces/NotificationHubs,outgoing.gcm.wrongchannel,GCM Wrong Channel Error,Count,Total,"The count of pushes that failed because the registrationId in the registration is not associated to the current app (GCM result: InvalidPackageName).",,,,,,,,,,
Microsoft.NotificationHubs/Namespaces/NotificationHubs,outgoing.mpns.authenticationerror,MPNS Authentication Errors,Count,Total,"The count of pushes that failed because the PNS did not accept the provided credentials or the credentials are blocked.",,,,,,,,,,
Microsoft.NotificationHubs/Namespaces/NotificationHubs,outgoing.mpns.badchannel,MPNS Bad Channel Error,Count,Total,"The count of pushes that failed because the ChannelURI in the registration was not recognized (MPNS status: 404 not found).",,,,,,,,,,
Microsoft.NotificationHubs/Namespaces/NotificationHubs,outgoing.mpns.channeldisconnected,MPNS Channel Disconnected,Count,Total,"The count of pushes that failed because the ChannelURI in the registration was disconnected (MPNS status: 412 not found).",,,,,,,,,,
Microsoft.NotificationHubs/Namespaces/NotificationHubs,outgoing.mpns.dropped,MPNS Dropped Notifications,Count,Total,"The count of pushes that were dropped by MPNS (MPNS response header: X-NotificationStatus: QueueFull or Suppressed).",,,,,,,,,,
Microsoft.NotificationHubs/Namespaces/NotificationHubs,outgoing.mpns.invalidcredentials,MPNS Invalid Credentials,Count,Total,"The count of pushes that failed because the PNS did not accept the provided credentials or the credentials are blocked.",,,,,,,,,,
Microsoft.NotificationHubs/Namespaces/NotificationHubs,outgoing.mpns.invalidnotificationformat,MPNS Invalid Notification Format,Count,Total,"The count of pushes that failed because the payload of the notification was too large.",,,,,,,,,,
Microsoft.NotificationHubs/Namespaces/NotificationHubs,outgoing.mpns.pnserror,MPNS Errors,Count,Total,"The count of pushes that failed because of errors communicating with MPNS.",,,,,,,,,,
Microsoft.NotificationHubs/Namespaces/NotificationHubs,outgoing.mpns.success,MPNS Successful Notifications,Count,Total,"The count of all successful notifications.",,,,,,,,,,
Microsoft.NotificationHubs/Namespaces/NotificationHubs,outgoing.mpns.throttled,MPNS Throttled Notifications,Count,Total,"The count of pushes that failed because MPNS is throttling this app (WNS MPNS: 406 Not Acceptable).",,,,,,,,,,
Microsoft.NotificationHubs/Namespaces/NotificationHubs,outgoing.wns.authenticationerror,WNS Authentication Errors,Count,Total,"Notification not delivered because of errors communicating with Windows Live invalid credentials or wrong token.",,,,,,,,,,
Microsoft.NotificationHubs/Namespaces/NotificationHubs,outgoing.wns.badchannel,WNS Bad Channel Error,Count,Total,"The count of pushes that failed because the ChannelURI in the registration was not recognized (WNS status: 404 not found).",,,,,,,,,,
Microsoft.NotificationHubs/Namespaces/NotificationHubs,outgoing.wns.channeldisconnected,WNS Channel Disconnected,Count,Total,"The notification was dropped because the ChannelURI in the registration is throttled (WNS response header: X-WNS-DeviceConnectionStatus: disconnected).",,,,,,,,,,
Microsoft.NotificationHubs/Namespaces/NotificationHubs,outgoing.wns.channelthrottled,WNS Channel Throttled,Count,Total,"The notification was dropped because the ChannelURI in the registration is throttled (WNS response header: X-WNS-NotificationStatus:channelThrottled).",,,,,,,,,,
Microsoft.NotificationHubs/Namespaces/NotificationHubs,outgoing.wns.dropped,WNS Dropped Notifications,Count,Total,"The notification was dropped because the ChannelURI in the registration is throttled (X-WNS-NotificationStatus: dropped but not X-WNS-DeviceConnectionStatus: disconnected).",,,,,,,,,,
Microsoft.NotificationHubs/Namespaces/NotificationHubs,outgoing.wns.expiredchannel,WNS Expired Channel Error,Count,Total,"The count of pushes that failed because the ChannelURI is expired (WNS status: 410 Gone).",,,,,,,,,,
Microsoft.NotificationHubs/Namespaces/NotificationHubs,outgoing.wns.invalidcredentials,WNS Authorization Errors (Invalid Credentials),Count,Total,"The count of pushes that failed because the PNS did not accept the provided credentials or the credentials are blocked. (Windows Live does not recognize the credentials).",,,,,,,,,,
Microsoft.NotificationHubs/Namespaces/NotificationHubs,outgoing.wns.invalidnotificationformat,WNS Invalid Notification Format,Count,Total,"The format of the notification is invalid (WNS status: 400). Note that WNS does not reject all invalid payloads.",,,,,,,,,,
Microsoft.NotificationHubs/Namespaces/NotificationHubs,outgoing.wns.invalidnotificationsize,WNS Invalid Notification Size Error,Count,Total,"The notification payload is too large (WNS status: 413).",,,,,,,,,,
Microsoft.NotificationHubs/Namespaces/NotificationHubs,outgoing.wns.invalidtoken,WNS Authorization Errors (Invalid Token),Count,Total,"The token provided to WNS is not valid (WNS status: 401 Unauthorized).",,,,,,,,,,
Microsoft.NotificationHubs/Namespaces/NotificationHubs,outgoing.wns.pnserror,WNS Errors,Count,Total,"Notification not delivered because of errors communicating with WNS.",,,,,,,,,,
Microsoft.NotificationHubs/Namespaces/NotificationHubs,outgoing.wns.success,WNS Successful Notifications,Count,Total,"The count of all successful notifications.",,,,,,,,,,
Microsoft.NotificationHubs/Namespaces/NotificationHubs,outgoing.wns.throttled,WNS Throttled Notifications,Count,Total,"The count of pushes that failed because WNS is throttling this app (WNS status: 406 Not Acceptable).",,,,,,,,,,
Microsoft.NotificationHubs/Namespaces/NotificationHubs,outgoing.wns.tokenproviderunreachable,WNS Authorization Errors (Unreachable),Count,Total,"Windows Live is not reachable.",,,,,,,,,,
Microsoft.NotificationHubs/Namespaces/NotificationHubs,outgoing.wns.wrongtoken,WNS Authorization Errors (Wrong Token),Count,Total,"The token provided to WNS is valid but for another application (WNS status: 403 Forbidden). This can happen if the ChannelURI in the registration is associated with another app. Check that the client app is associated with the same app whose credentials are in the notification hub.",,,,,,,,,,
Microsoft.NotificationHubs/Namespaces/NotificationHubs,registration.all,Registration Operations,Count,Total,"The count of all successful registration operations (creations updates queries and deletions).",,,,,,,,,,
Microsoft.NotificationHubs/Namespaces/NotificationHubs,registration.create,Registration Create Operations,Count,Total,"The count of all successful registration creations.",,,,,,,,,,
Microsoft.NotificationHubs/Namespaces/NotificationHubs,registration.delete,Registration Delete Operations,Count,Total,"The count of all successful registration deletions.",,,,,,,,,,
Microsoft.NotificationHubs/Namespaces/NotificationHubs,registration.get,Registration Read Operations,Count,Total,"The count of all successful registration queries.",,,,,,,,,,
Microsoft.NotificationHubs/Namespaces/NotificationHubs,registration.update,Registration Update Operations,Count,Total,"The count of all successful registration updates.",,,,,,,,,,
Microsoft.NotificationHubs/Namespaces/NotificationHubs,scheduled.pending,Pending Scheduled Notifications,Count,Total,"Pending Scheduled Notifications",,,,,,,,,,
Microsoft.OperationalInsights/workspaces,Average_% Available Memory,% Available Memory,Count,Average,"Average_% Available Memory. Supported for: Linux. Part of metric alerts for logs feature.",,,,,,,,,,
Microsoft.OperationalInsights/workspaces,Average_% Available Swap Space,% Available Swap Space,Count,Average,"Average_% Available Swap Space. Supported for: Linux. Part of metric alerts for logs feature.",,,,,,,,,,
Microsoft.OperationalInsights/workspaces,Average_% Committed Bytes In Use,% Committed Bytes In Use,Count,Average,"Average_% Committed Bytes In Use. Supported for: Windows. Part of metric alerts for logs feature.",,,,,,,,,,
Microsoft.OperationalInsights/workspaces,Average_% DPC Time,% DPC Time,Count,Average,"Average_% DPC Time. Supported for: Linux, Windows. Part of metric alerts for logs feature.",,,,,,,,,,
Microsoft.OperationalInsights/workspaces,Average_% Free Inodes,% Free Inodes,Count,Average,"Average_% Free Inodes. Supported for: Linux. Part of metric alerts for logs feature.",,,,,,,,,,
Microsoft.OperationalInsights/workspaces,Average_% Free Space,% Free Space,Count,Average,"Average_% Free Space. Supported for: Linux, Windows. Part of metric alerts for logs feature.",,,,,,,,,,
Microsoft.OperationalInsights/workspaces,Average_% Idle Time,% Idle Time,Count,Average,"Average_% Idle Time. Supported for: Linux, Windows. Part of metric alerts for logs feature.",,,,,,,,,,
Microsoft.OperationalInsights/workspaces,Average_% Interrupt Time,% Interrupt Time,Count,Average,"Average_% Interrupt Time. Supported for: Linux, Windows. Part of metric alerts for logs feature.",,,,,,,,,,
Microsoft.OperationalInsights/workspaces,Average_% IO Wait Time,% IO Wait Time,Count,Average,"Average_% IO Wait Time. Supported for: Linux. Part of metric alerts for logs feature.",,,,,,,,,,
Microsoft.OperationalInsights/workspaces,Average_% Nice Time,% Nice Time,Count,Average,"Average_% Nice Time. Supported for: Linux. Part of metric alerts for logs feature.",,,,,,,,,,
Microsoft.OperationalInsights/workspaces,Average_% Privileged Time,% Privileged Time,Count,Average,"Average_% Privileged Time. Supported for: Linux, Windows. Part of metric alerts for logs feature.",,,,,,,,,,
Microsoft.OperationalInsights/workspaces,Average_% Processor Time,% Processor Time,Count,Average,"Average_% Processor Time. Supported for: Linux, Windows. Part of metric alerts for logs feature.",,,,,,,,,,
Microsoft.OperationalInsights/workspaces,Average_% Used Inodes,% Used Inodes,Count,Average,"Average_% Used Inodes. Supported for: Linux. Part of metric alerts for logs feature.",,,,,,,,,,
Microsoft.OperationalInsights/workspaces,Average_% Used Memory,% Used Memory,Count,Average,"Average_% Used Memory. Supported for: Linux. Part of metric alerts for logs feature.",,,,,,,,,,
Microsoft.OperationalInsights/workspaces,Average_% Used Space,% Used Space,Count,Average,"Average_% Used Space. Supported for: Linux. Part of metric alerts for logs feature.",,,,,,,,,,
Microsoft.OperationalInsights/workspaces,Average_% Used Swap Space,% Used Swap Space,Count,Average,"Average_% Used Swap Space. Supported for: Linux. Part of metric alerts for logs feature.",,,,,,,,,,
Microsoft.OperationalInsights/workspaces,Average_% User Time,% User Time,Count,Average,"Average_% User Time. Supported for: Linux, Windows. Part of metric alerts for logs feature.",,,,,,,,,,
Microsoft.OperationalInsights/workspaces,Average_Available MBytes,Available MBytes,Count,Average,"Average_Available MBytes. Supported for: Windows. Part of metric alerts for logs feature.",,,,,,,,,,
Microsoft.OperationalInsights/workspaces,Average_Available MBytes Memory,Available MBytes Memory,Count,Average,"Average_Available MBytes Memory. Supported for: Linux. Part of metric alerts for logs feature.",,,,,,,,,,
Microsoft.OperationalInsights/workspaces,Average_Available MBytes Swap,Available MBytes Swap,Count,Average,"Average_Available MBytes Swap. Supported for: Linux. Part of metric alerts for logs feature.",,,,,,,,,,
Microsoft.OperationalInsights/workspaces,Average_Avg. Disk sec/Read,Avg. Disk sec/Read,Count,Average,"Average_Avg. Disk sec/Read. Supported for: Linux, Windows. Part of metric alerts for logs feature.",,,,,,,,,,
Microsoft.OperationalInsights/workspaces,Average_Avg. Disk sec/Transfer,Avg. Disk sec/Transfer,Count,Average,"Average_Avg. Disk sec/Transfer. Supported for: Linux, Windows. Part of metric alerts for logs feature.",,,,,,,,,,
Microsoft.OperationalInsights/workspaces,Average_Avg. Disk sec/Write,Avg. Disk sec/Write,Count,Average,"Average_Avg. Disk sec/Write. Supported for: Linux, Windows. Part of metric alerts for logs feature.",,,,,,,,,,
Microsoft.OperationalInsights/workspaces,Average_Bytes Received/sec,Bytes Received/sec,Count,Average,"Average_Bytes Received/sec. Supported for: Windows. Part of metric alerts for logs feature.",,,,,,,,,,
Microsoft.OperationalInsights/workspaces,Average_Bytes Sent/sec,Bytes Sent/sec,Count,Average,"Average_Bytes Sent/sec. Supported for: Windows. Part of metric alerts for logs feature.",,,,,,,,,,
Microsoft.OperationalInsights/workspaces,Average_Bytes Total/sec,Bytes Total/sec,Count,Average,"Average_Bytes Total/sec. Supported for: Windows. Part of metric alerts for logs feature.",,,,,,,,,,
Microsoft.OperationalInsights/workspaces,Average_Current Disk Queue Length,Current Disk Queue Length,Count,Average,"Average_Current Disk Queue Length. Supported for: Windows. Part of metric alerts for logs feature.",,,,,,,,,,
Microsoft.OperationalInsights/workspaces,Average_Disk Read Bytes/sec,Disk Read Bytes/sec,Count,Average,"Average_Disk Read Bytes/sec. Supported for: Linux, Windows. Part of metric alerts for logs feature.",,,,,,,,,,
Microsoft.OperationalInsights/workspaces,Average_Disk Reads/sec,Disk Reads/sec,Count,Average,"Average_Disk Reads/sec. Supported for: Linux, Windows. Part of metric alerts for logs feature.",,,,,,,,,,
Microsoft.OperationalInsights/workspaces,Average_Disk Transfers/sec,Disk Transfers/sec,Count,Average,"Average_Disk Transfers/sec. Supported for: Linux, Windows. Part of metric alerts for logs feature.",,,,,,,,,,
Microsoft.OperationalInsights/workspaces,Average_Disk Write Bytes/sec,Disk Write Bytes/sec,Count,Average,"Average_Disk Write Bytes/sec. Supported for: Linux, Windows. Part of metric alerts for logs feature.",,,,,,,,,,
Microsoft.OperationalInsights/workspaces,Average_Disk Writes/sec,Disk Writes/sec,Count,Average,"Average_Disk Writes/sec. Supported for: Linux, Windows. Part of metric alerts for logs feature.",,,,,,,,,,
Microsoft.OperationalInsights/workspaces,Average_Free Megabytes,Free Megabytes,Count,Average,"Average_Free Megabytes. Supported for: Linux, Windows. Part of metric alerts for logs feature.",,,,,,,,,,
Microsoft.OperationalInsights/workspaces,Average_Free Physical Memory,Free Physical Memory,Count,Average,"Average_Free Physical Memory. Supported for: Linux. Part of metric alerts for logs feature.",,,,,,,,,,
Microsoft.OperationalInsights/workspaces,Average_Free Space in Paging Files,Free Space in Paging Files,Count,Average,"Average_Free Space in Paging Files. Supported for: Linux. Part of metric alerts for logs feature.",,,,,,,,,,
Microsoft.OperationalInsights/workspaces,Average_Free Virtual Memory,Free Virtual Memory,Count,Average,"Average_Free Virtual Memory. Supported for: Linux. Part of metric alerts for logs feature.",,,,,,,,,,
Microsoft.OperationalInsights/workspaces,Average_Logical Disk Bytes/sec,Logical Disk Bytes/sec,Count,Average,"Average_Logical Disk Bytes/sec. Supported for: Linux. Part of metric alerts for logs feature.",,,,,,,,,,
Microsoft.OperationalInsights/workspaces,Average_Page Reads/sec,Page Reads/sec,Count,Average,"Average_Page Reads/sec. Supported for: Linux, Windows. Part of metric alerts for logs feature.",,,,,,,,,,
Microsoft.OperationalInsights/workspaces,Average_Page Writes/sec,Page Writes/sec,Count,Average,"Average_Page Writes/sec. Supported for: Linux, Windows. Part of metric alerts for logs feature.",,,,,,,,,,
Microsoft.OperationalInsights/workspaces,Average_Pages/sec,Pages/sec,Count,Average,"Average_Pages/sec. Supported for: Linux, Windows. Part of metric alerts for logs feature.",,,,,,,,,,
Microsoft.OperationalInsights/workspaces,Average_Pct Privileged Time,Pct Privileged Time,Count,Average,"Average_Pct Privileged Time. Supported for: Linux. Part of metric alerts for logs feature.",,,,,,,,,,
Microsoft.OperationalInsights/workspaces,Average_Pct User Time,Pct User Time,Count,Average,"Average_Pct User Time. Supported for: Linux. Part of metric alerts for logs feature.",,,,,,,,,,
Microsoft.OperationalInsights/workspaces,Average_Physical Disk Bytes/sec,Physical Disk Bytes/sec,Count,Average,"Average_Physical Disk Bytes/sec. Supported for: Linux. Part of metric alerts for logs feature.",,,,,,,,,,
Microsoft.OperationalInsights/workspaces,Average_Processes,Processes,Count,Average,"Average_Processes. Supported for: Linux, Windows. Part of metric alerts for logs feature.",,,,,,,,,,
Microsoft.OperationalInsights/workspaces,Average_Processor Queue Length,Processor Queue Length,Count,Average,"Average_Processor Queue Length. Supported for: Windows. Part of metric alerts for logs feature.",,,,,,,,,,
Microsoft.OperationalInsights/workspaces,Average_Size Stored In Paging Files,Size Stored In Paging Files,Count,Average,"Average_Size Stored In Paging Files. Supported for: Linux. Part of metric alerts for logs feature.",,,,,,,,,,
Microsoft.OperationalInsights/workspaces,Average_Total Bytes,Total Bytes,Count,Average,"Average_Total Bytes. Supported for: Linux. Part of metric alerts for logs feature.",,,,,,,,,,
Microsoft.OperationalInsights/workspaces,Average_Total Bytes Received,Total Bytes Received,Count,Average,"Average_Total Bytes Received. Supported for: Linux. Part of metric alerts for logs feature.",,,,,,,,,,
Microsoft.OperationalInsights/workspaces,Average_Total Bytes Transmitted,Total Bytes Transmitted,Count,Average,"Average_Total Bytes Transmitted. Supported for: Linux. Part of metric alerts for logs feature.",,,,,,,,,,
Microsoft.OperationalInsights/workspaces,Average_Total Collisions,Total Collisions,Count,Average,"Average_Total Collisions. Supported for: Linux. Part of metric alerts for logs feature.",,,,,,,,,,
Microsoft.OperationalInsights/workspaces,Average_Total Packets Received,Total Packets Received,Count,Average,"Average_Total Packets Received. Supported for: Linux. Part of metric alerts for logs feature.",,,,,,,,,,
Microsoft.OperationalInsights/workspaces,Average_Total Packets Transmitted,Total Packets Transmitted,Count,Average,"Average_Total Packets Transmitted. Supported for: Linux. Part of metric alerts for logs feature.",,,,,,,,,,
Microsoft.OperationalInsights/workspaces,Average_Total Rx Errors,Total Rx Errors,Count,Average,"Average_Total Rx Errors. Supported for: Linux. Part of metric alerts for logs feature.",,,,,,,,,,
Microsoft.OperationalInsights/workspaces,Average_Total Tx Errors,Total Tx Errors,Count,Average,"Average_Total Tx Errors. Supported for: Linux. Part of metric alerts for logs feature.",,,,,,,,,,
Microsoft.OperationalInsights/workspaces,Average_Uptime,Uptime,Count,Average,"Average_Uptime. Supported for: Linux. Part of metric alerts for logs feature.",,,,,,,,,,
Microsoft.OperationalInsights/workspaces,Average_Used MBytes Swap Space,Used MBytes Swap Space,Count,Average,". Supported for: Linux. Part of metric alerts for logs feature.",,,,,,,,,,
Microsoft.OperationalInsights/workspaces,Average_Used Memory kBytes,Used Memory kBytes,Count,Average,"Average_Used Memory kBytes. Supported for: Linux. Part of metric alerts for logs feature.",,,,,,,,,,
Microsoft.OperationalInsights/workspaces,Average_Used Memory MBytes,Used Memory MBytes,Count,Average,"Average_Used Memory MBytes. Supported for: Linux. Part of metric alerts for logs feature.",,,,,,,,,,
Microsoft.OperationalInsights/workspaces,Average_Users,Users,Count,Average,"Average_Users. Supported for: Linux. Part of metric alerts for logs feature.",,,,,,,,,,
